{
  "$schema": "http://json-schema.org/draft-07/schema#",
  "title": "FundPortfolioInput",
  "description": "Real-data-ready portfolio input format for fund-agent workflows. All demo data must be synthetic. No real private data.",
  "type": "object",
  "required": ["schema_version", "as_of_date", "holdings"],
  "properties": {
    "schema_version": {
      "type": "string",
      "const": "fund_portfolio_input.v1"
    },
    "user_question": {
      "type": "string",
      "description": "User's natural language question"
    },
    "analysis_mode": {
      "type": "string",
      "enum": ["report_only", "soft_action_advice", "formal_trade_decision"],
      "default": "report_only"
    },
    "as_of_date": {
      "type": "string",
      "description": "Portfolio as-of date (YYYY-MM-DD)"
    },
    "base_currency": {
      "type": "string",
      "default": "CNY"
    },
    "holdings": {
      "type": "array",
      "items": {
        "type": "object",
        "required": ["fund_code", "current_value"],
        "properties": {
          "fund_code": {"type": "string"},
          "fund_name": {"type": "string"},
          "share_class": {"type": "string"},
          "current_value": {"type": "number"},
          "units": {"type": ["number", "null"]},
          "cost_basis": {"type": ["number", "null"]},
          "cost_basis_confidence": {"type": "string", "enum": ["exact", "estimated", "unknown"], "default": "unknown"},
          "holding_days": {"type": ["integer", "null"]},
          "unrealized_pnl": {"type": ["number", "null"]},
          "unrealized_pnl_pct": {"type": ["number", "null"]},
          "principal_recovered": {"type": ["boolean", "null"]},
          "source": {"type": "string"},
          "source_platform": {"type": "string", "description": "Platform where the holding originates (e.g. alipay, tiantian, manual_snapshot)"},
          "holding_source": {"type": "string", "enum": ["manual_snapshot", "provider_snapshot", "transaction_derived", "unknown"], "description": "How this holding entry was obtained"},
          "source_notes": {"type": "string", "description": "Free-text notes about the source or reliability of this holding"},
          "transaction_evidence_refs": {"type": "array", "items": {"type": "string"}, "description": "References to transaction records that support this holding"},
          "pending_transaction_count": {"type": "integer", "description": "Number of pending (unconfirmed) transactions related to this holding"}
        }
      }
    },
    "cash_allocation": {
      "type": "object",
      "properties": {
        "money_market_value": {"type": ["number", "null"]},
        "bond_allocation_value": {"type": ["number", "null"]},
        "cash_available": {"type": ["number", "null"]}
      }
    },
    "transaction_history_ref": {
      "type": "string",
      "description": "Reference to transaction history file path"
    },
    "provider_data_snapshot_ref": {
      "type": "string",
      "description": "Reference to provider data snapshot file path"
    },
    "risk_profile_ref": {
      "type": "string",
      "description": "Reference to risk profile file path"
    },
    "constraints_ref": {
      "type": "string",
      "description": "Reference to constraints file path"
    },
    "manual_transactions_ref": {
      "type": "string",
      "description": "Reference to manual transaction entries file path (e.g. manual_transactions.private.csv)"
    },
    "manual_transactions_format": {
      "type": "string",
      "enum": ["manual_csv"],
      "description": "Format of the manual transactions file referenced by manual_transactions_ref"
    },
    "source_notes": {
      "type": "string",
      "description": "Free-text notes about the source or reliability of the portfolio data"
    },
    "transaction_evidence_refs": {
      "type": "array",
      "items": {"type": "string"},
      "description": "References to transaction records that support this portfolio"
    },
    "pending_transaction_count": {
      "type": "integer",
      "description": "Number of pending (unconfirmed) transactions across the portfolio"
    },
    "user_preferences": {
      "type": "object",
      "properties": {
        "language": {"type": "string", "default": "zh-CN"},
        "report_style": {"type": "string", "enum": ["detailed", "summary", "minimal"], "default": "detailed"},
        "include_fee_analysis": {"type": "boolean", "default": true},
        "include_redemption_check": {"type": "boolean", "default": true}
      }
    },
    "data_quality": {
      "type": "object",
      "properties": {
        "missing_fields": {"type": "array", "items": {"type": "string"}},
        "estimated_fields": {"type": "array", "items": {"type": "string"}},
        "data_source_notes": {"type": "array", "items": {"type": "string"}},
        "validated_against_manual_transactions": {"type": "boolean", "description": "Whether portfolio data has been cross-validated against manual transaction records"},
        "transaction_history_incomplete": {"type": "boolean", "description": "Whether the transaction history is known to be incomplete"},
        "fund_code_missing": {"type": "boolean", "description": "Whether any holding is missing a fund_code"},
        "units_missing": {"type": "boolean", "description": "Whether any holding is missing units"},
        "nav_missing": {"type": "boolean", "description": "Whether any holding is missing NAV data"},
        "cost_basis_partial": {"type": "boolean", "description": "Whether cost_basis is only partially available (some null, some present)"}
      }
    },
    "privacy_mode": {
      "type": "string",
      "enum": ["full", "amounts_redacted", "anonymous"],
      "default": "full"
    },
    "output_preferences": {
      "type": "object",
      "properties": {
        "format": {"type": "string", "enum": ["json", "markdown"], "default": "json"},
        "output_path": {"type": "string"}
      }
    }
  }
}
